{"version":1,"type":"node.heartbeat","request_id":"01K0ABCDEFGHJKMNPQRSTVWXYZ","node_id":"00000000-0000-4000-8000-000000000001","timestamp":"2026-07-24T01:00:00Z","payload":{"daemon_version":"1.0.0","active_sessions":3,"resources":{"cpu_usage":12.5,"memory_usage":40.1,"load_average":0.7,"disk_usage":55.0,"daemon_uptime":3600}}}
