{"version":1,"type":"filesystem.entries","request_id":"01K0ABCDEFGHJKMNPQRSTVWX04","node_id":"00000000-0000-4000-8000-000000000001","timestamp":"2026-07-25T09:00:00Z","payload":{"path":"backend/app","root_display_name":"Projects","truncated":false,"entries":[{"name":"main.py","rel_path":"backend/app/main.py","type":"file","size":1024,"modified_at":"2026-07-25T08:00:00Z","hidden":false,"symlink":false,"excluded":false,"expandable":false}]}}
