{"version":1,"type":"filesystem.preview_opened","request_id":"01K6BP0PEN000000000000000A","node_id":"00000000-0000-4000-8000-000000000001","timestamp":"2026-09-27T09:00:00Z","success":true,"payload":{"success":true,"preview_id":"01K6B9R3V1EW7Q2M8N4X6Y0Z5T","path":"docs/diagram.png","kind":"image","mime":"image/png","size":3145728,"modified_at":"2026-09-27T08:00:00Z","chunk_size":524288,"chunk_count":6,"width":1170,"height":2532}}
