{"version":1,"type":"node.runtime_status","request_id":"01K0ABCDEFGHJKMNPQRSTVWXYZ","node_id":"00000000-0000-4000-8000-000000000001","timestamp":"2026-07-24T01:00:00Z","payload":{"runtimes":[{"runtime":"claude","available":true,"version":"1.2.3","binary_path":"/usr/local/bin/claude","checked_at":"2026-07-24T01:00:00Z"},{"runtime":"codex","available":false}]}}
