{"version": 1, "type": "filesystem.upload", "request_id": "01K0ABCDEFGHJKMNPQRSTVWX03", "node_id": "00000000-0000-4000-8000-000000000001", "timestamp": "2026-08-05T09:00:00Z", "payload": {"session_id": "00000000-0000-4000-8000-000000000002", "data": "iVBORw0KGgoAAAANSUhEUgAAAAEAAAABCAYAAAAfFcSJAAAACklEQVR4nGNgAAACAAEABf4C/gAAAABJRU5ErkJggg=="}}
