{"version": 1, "type": "node.register", "request_id": "01K0ABCDEFGHJKMNPQRSTVWX16", "node_id": "00000000-0000-4000-8000-000000000001", "timestamp": "2026-08-05T09:00:00Z", "payload": {"name": "node-a", "hostname": "node-a.local", "os": "linux", "os_version": "Ubuntu 24.04", "architecture": "amd64", "daemon_version": "0.13.0", "run_user": "agentd", "runtimes": [], "workspace_roots": [], "image_upload": true, "file_upload": false}}
