{"version":1,"type":"filesystem.preview_opened","request_id":"01K6BP0PEN000000000000000C","node_id":"00000000-0000-4000-8000-000000000001","timestamp":"2026-09-27T09:00:00Z","success":false,"payload":{"success":false,"path":"photos/bomb.png","error":{"code":"FILE_PREVIEW_LIMIT","reason":"pixels"}}}
