{"version":1,"type":"node.heartbeat","request_id":"01K0ABCDEFGHJKMNPQRSTVWXYZ","node_id":"00000000-0000-4000-8000-000000000001","timestamp":"2026-08-11T01:00:00Z","payload":{"daemon_version":"0.9.0","active_sessions":1,"runner":{"blocked_reason":"disk_quota","disk_used_bytes":5153960755,"disk_quota_bytes":5368709120}}}
