{"version":1,"type":"node.auth","request_id":"01K0ABCDEFGHJKMNPQRSTVWXYZ","node_id":"00000000-0000-4000-8000-000000000001","timestamp":"2026-07-24T01:00:00Z","payload":{"challenge_id":"01K0ABCDEFGHJKMNPQRSTVWXYZ","signature":"AAAAAAAAAAAAAAAAAAAAAAAAAAAAAAAAAAAAAAAAAAAAAAAAAAAAAAAAAAAAAAAAAAAAAAAAAAAAAAAAAAAAAA=="}}
