{"version":1,"type":"node.register","request_id":"01K0ABCDEFGHJKMNPQRSTVWXYZ","node_id":"00000000-0000-4000-8000-000000000001","timestamp":"2026-07-24T01:00:00Z","payload":{"name":"dev-vm-01","hostname":"dev-vm-01","os":"linux","os_version":"Ubuntu 24.04","architecture":"amd64","daemon_version":"1.0.0","run_user":"neil","runtimes":[{"runtime":"claude","available":true,"version":"1.2.3","binary_path":"/usr/local/bin/claude","checked_at":"2026-07-24T01:00:00Z"},{"runtime":"codex","available":false}],"workspace_roots":[{"path":"/home/neil/work","display_name":"work","is_enabled":true}]}}
