{"version": 1, "type": "filesystem.uploaded", "request_id": "01K0ABCDEFGHJKMNPQRSTVWX03", "node_id": "00000000-0000-4000-8000-000000000001", "timestamp": "2026-08-05T09:00:00Z", "success": true, "payload": {"path": ".cliora/uploads/2026-08-05/01K1ZQ9F3B7T2M8V4X6Y0N5R3D.png", "mime": "image/png", "size": 95, "modified_at": "2026-08-05T09:00:00Z"}}
