{"version":1,"type":"node.register","request_id":"01K0TN0000000000000000000A","node_id":"00000000-0000-4000-8000-000000000001","timestamp":"2026-08-01T09:00:00Z","payload":{"name":"dev-vm-01","hostname":"dev-vm-01","os":"linux","os_version":"Ubuntu 24.04","architecture":"amd64","daemon_version":"0.5.0","run_user":"neil","privileged_terminal":true,"runtimes":[{"runtime":"codex","available":true,"version":"codex 1.2.3","binary_path":"/usr/local/bin/codex","checked_at":"2026-08-01T09:00:00Z","sandbox_bypass":true},{"runtime":"shell","available":true,"binary_path":"/usr/bin/bash"}],"workspace_roots":[{"path":"/home/neil/projects","is_enabled":true}]}}
