{"version":1,"type":"session.start","request_id":"01K0ABCDEFGHJKMNPQRSTVWXY2","node_id":"00000000-0000-4000-8000-000000000001","timestamp":"2026-07-24T09:00:00Z","payload":{"session_id":"00000000-0000-4000-8000-000000000002","runtime":"claude","workspace":"/home/neil/projects/app","rows":40,"columns":140}}
