{"version":1,"type":"node.runtime_status","request_id":"01K0TN0000000000000000000A","node_id":"00000000-0000-4000-8000-000000000001","timestamp":"2026-08-01T09:05:00Z","payload":{"runtimes":[{"runtime":"claude","available":true,"version":"1.2.3","binary_path":"/usr/local/bin/claude","checked_at":"2026-08-01T09:05:00Z"},{"runtime":"codex","available":false}],"tunnel":{"veto":false,"ssh_available":true,"egress_ok":true,"known_hosts_ok":true,"daemon_supports_tunnel":true,"allowed_ports":["3000-3999"],"max_tunnels":2}}}
