{"version": 1, "type": "filesystem.store", "request_id": "01K0ABCDEFGHJKMNPQRSTVWX10", "node_id": "00000000-0000-4000-8000-000000000001", "timestamp": "2026-08-05T09:00:00Z", "payload": {"session_id": "00000000-0000-4000-8000-000000000002", "directory": "datasets", "filename": "data.csv", "data": "YSxiCjEsMgo="}}
