{"version":1,"type":"daemon.update_result","request_id":"01K0ABCDEFGHJKMNPQRSTVWX23","node_id":"00000000-0000-4000-8000-000000000001","timestamp":"2026-07-25T09:00:00Z","success":false,"payload":{"from_version":"0.9.3","to_version":"1.0.0","status":"rolled_back","stage":"healthcheck","error_code":"UPDATE_HEALTHCHECK_FAILED"}}
