{"version": 1, "type": "filesystem.downloaded", "request_id": "01K0ABCDEFGHJKMNPQRSTVWX21", "node_id": "00000000-0000-4000-8000-000000000001", "timestamp": "2026-09-16T09:00:00Z", "success": true, "payload": {"path": "datasets/data.csv", "size": 6, "modified_at": "2026-09-16T09:00:00Z", "data": "YSxiCjEsMgo="}}
