{"version":1,"type":"tunnel.open","request_id":"01K0TN00000000000000000001","node_id":"00000000-0000-4000-8000-000000000001","timestamp":"2026-08-01T09:00:00Z","payload":{"tunnel_id":"00000000-0000-4000-8000-0000000000a1","port":5173,"protection":"basic","credential":"AAAAAAAAAAAA","basic_auth":{"username":"preview","password":"AAAAAAAAAAAAAAAAAAAAAAAA"},"ttl_seconds":14400}}
